2025-04-15 14:00:00,Hà Nội: Đại Học Bách Khoa cổng Parabol đường Giải Phóng (KK),170,82.6,197.8,121.3,31.3,9.6,N/A,81,61,10.1
2025-04-15 14:00:00,Hà Nội: Công viên hồ điều hòa Nhân Chính  Khuất Duy Tiến (KK),164,73.7,178.4,63.8,3.9,9.5,2.9,81,60,10.4
2025-04-15 14:00:00,Minh Khai - Bắc Từ Liêm,127,18.5,208.7,31.7,N/A,0,3.9,81,59,10.4
2025-04-15 14:00:00,Vũng Tàu: Ngã tư Giếng nước - Tp.Vũng Tàu (KK),71,20,49.5,80.2,11,6.7,0.5,82,78,18.9
2025-04-15 14:00:00,Hải Dương: UBND TP. Hải Dương - 106 Đường Trần Hưng Đạo (KK),186,106.1,217.1,N/A,1.3,1.6,2.6,68,72,7.5
2025-04-15 14:00:00,Thừa Thiên Huế: 83 đường Hùng Vương (KK),110,39.1,113,13.8,11.4,63.4,1.2,73,83,2.3
2025-04-15 14:00:00,Phú Thọ: đường Hùng Vương - Tp Việt Trì (KK),71,19.7,31.6,126.1,35.7,36.3,2.4,75,54,11.5
